{
  "fragmentVersion": 1,
  "sessionId": "C",
  "shard": 2,
  "batchId": "oatstraw-green-oat-boundary-20260830",
  "createdAt": "2026-08-30T00:18:00.000Z",
  "submissions": [
    {
      "submissionId": "sub_session-c-oatstraw-cognitaven-short-chronic-20260830",
      "authoringPackId": "ap_bp_wp_herb_oatstraw_src_doi_10_3390_nu12061598",
      "workpackId": "wp_herb_oatstraw",
      "entityType": "herb",
      "entitySlug": "oatstraw",
      "sourceId": "src_doi-10-3390-nu12061598",
      "topicType": "population_specific_note",
      "claimType": "population_note",
      "evidenceClass": "human-clinical",
      "findingTextShort": "A 29-day Cognitaven green-oat extract trial reported selected cognition and physiological stress-response signals but no mood effect.",
      "findingTextNormalized": "A randomized double-blind placebo-controlled dose-ranging trial assigned 132 healthy adults aged 35–65 to Cognitaven green-oat extract at 430, 860 or 1290 mg/day or placebo for 29 days. Selected working-memory/multitasking measures improved at some doses and the highest chronic dose reduced electrodermal response to a laboratory stressor, while no treatment-related mood effect was detected. These are proprietary green-oat-extract findings rather than evidence for generic oatstraw or milky-oat tincture.",
      "strengthLabel": "limited",
      "populationContext": "Healthy adults aged 35–65 in a 29-day dose-ranging trial.",
      "usageContext": "Cognitaven proprietary green-oat extract, 430/860/1290 mg/day; not milky oat tops tincture.",
      "uncertaintyNote": "Dose-specific/selective outcomes and commercial product identity constrain generalization. Draft-only pending governance.",
      "reviewStatus": "draft_submission",
      "editorialStatus": "draft",
      "active": true
    },
    {
      "submissionId": "sub_session-c-oatstraw-neuravena-chronic-null-20260830",
      "authoringPackId": "ap_bp_wp_herb_oatstraw_src_pubmed_22690320",
      "workpackId": "wp_herb_oatstraw",
      "entityType": "herb",
      "entitySlug": "oatstraw",
      "sourceId": "src_pubmed-22690320",
      "topicType": "unsupported_or_unclear_use",
      "claimType": "efficacy_null_or_mixed",
      "evidenceClass": "human-clinical",
      "findingTextShort": "A 12-week Neuravena wild-green-oat crossover trial found no sustained cognitive benefit in older adults with normal cognition.",
      "findingTextNormalized": "A randomized double-blind placebo-controlled crossover trial in 37 healthy older adults tested Neuravena wild-green-oat extract at 1500 mg/day for 12 weeks. Chronic supplementation did not improve any measured cognitive outcome. This null long-duration result must coexist with shorter acute/29-day signals and prevents a simple `long-term cognitive benefit` claim.",
      "strengthLabel": "limited",
      "populationContext": "Healthy older adults with normal cognition.",
      "usageContext": "Neuravena wild-green-oat extract, 1500 mg/day for 12 weeks.",
      "uncertaintyNote": "Small sample limits power, but the direct chronic null result remains first-class. Draft-only pending source governance.",
      "reviewStatus": "draft_submission",
      "editorialStatus": "draft",
      "active": true
    },
    {
      "submissionId": "sub_session-c-oatstraw-acute-neuravena-signal-20260830",
      "authoringPackId": "ap_bp_wp_herb_oatstraw_src_pubmed_26618715",
      "workpackId": "wp_herb_oatstraw",
      "entityType": "herb",
      "entitySlug": "oatstraw",
      "sourceId": "src_pubmed-26618715",
      "topicType": "population_specific_note",
      "claimType": "population_note",
      "evidenceClass": "human-clinical",
      "findingTextShort": "An acute Neuravena crossover study reported a selected processing-speed signal at 800 mg in middle-aged adults with subjective memory decline.",
      "findingTextNormalized": "A double-blind placebo-controlled counterbalanced crossover study in healthy adults aged 40–65 who reported age-related memory decline tested single doses of wild green-oat extract. The 800 mg condition improved speed on a global timed-task measure across post-dose assessments. This acute selective signal should remain separate from chronic outcomes and cannot be transferred to whole oatstraw or tincture preparations.",
      "strengthLabel": "limited",
      "populationContext": "Middle-aged healthy adults with subjective memory decline.",
      "usageContext": "Single-dose Neuravena wild-green-oat extract; selected acute cognition context.",
      "uncertaintyNote": "Acute selective-task findings do not establish durable cognitive or stress benefit. Draft-only pending governance.",
      "reviewStatus": "draft_submission",
      "editorialStatus": "draft",
      "active": true
    },
    {
      "submissionId": "sub_session-c-oatstraw-systematic-acute-chronic-split-20260830",
      "authoringPackId": "ap_bp_wp_herb_oatstraw_src_pubmed_36657906",
      "workpackId": "wp_herb_oatstraw",
      "entityType": "herb",
      "entitySlug": "oatstraw",
      "sourceId": "src_pubmed-36657906",
      "topicType": "conflict_note",
      "claimType": "evidence_conflict",
      "evidenceClass": "human-clinical",
      "findingTextShort": "A six-RCT systematic review found more favorable acute/short-term than long-term green-oat cognition evidence and rated the evidence only average quality.",
      "findingTextNormalized": "A systematic review of six randomized controlled trials involving 287 healthy participants concluded that acute Avena sativa extract supplementation may improve selected cognitive accuracy/speed outcomes, short-term chronic supplementation showed some favorable findings, and long-term chronic supplementation did not. Doses and formulations varied and overall evidence quality was average, so the literature supports an acute-versus-chronic evidence split rather than a stable generic cognitive benefit.",
      "strengthLabel": "limited",
      "populationContext": "Healthy adults across six randomized oat-extract trials.",
      "usageContext": "Avena sativa green/wild oat extracts with heterogeneous doses; not equivalent to whole straw or milky-oat tincture.",
      "uncertaintyNote": "Small trial count, dose disparity and formulation heterogeneity limit confidence. Draft-only pending governance.",
      "reviewStatus": "draft_submission",
      "editorialStatus": "draft",
      "active": true
    },
    {
      "submissionId": "sub_session-c-oatstraw-preparation-safety-gap-20260830",
      "authoringPackId": "ap_bp_wp_herb_oatstraw_src_doi_10_3390_nu12061598",
      "workpackId": "wp_herb_oatstraw",
      "entityType": "herb",
      "entitySlug": "oatstraw",
      "sourceId": "src_doi-10-3390-nu12061598",
      "topicType": "research_gap",
      "claimType": "research_gap",
      "evidenceClass": "human-clinical",
      "findingTextShort": "The current milky-oat-tops tincture dose text and broad sedative/antidepressant/pregnancy cautions are not established by the located green-oat-extract trials.",
      "findingTextNormalized": "The live Oatstraw profile refers to `Milky oat tops tincture` in dosage text and carries broad cautions about sedatives, alcohol, sleep aids, antidepressants and pregnancy/breastfeeding. The located human trials test standardized green/wild oat extracts and do not validate a tincture regimen or quantify those interaction/reproductive risks. Separate preparation-specific efficacy and safety receipts are required before those propositions can be promoted.",
      "strengthLabel": "strong",
      "usageContext": "Preparation and safety provenance gap; no consumer dose or interaction recommendation is generated here.",
      "uncertaintyNote": "Missing receipt does not prove a risk is absent; it requires independent validation. Keep NEEDS_REVIEW/noindex.",
      "reviewStatus": "draft_submission",
      "editorialStatus": "draft",
      "active": true
    }
  ]
}