{
  "fragmentVersion": 1,
  "sessionId": "B",
  "shard": 1,
  "batchId": "tryptophan-sleep-endpoint-boundaries-20260830",
  "createdAt": "2026-08-30T17:30:00.000Z",
  "submissions": [
    {
      "submissionId": "sub_session-b-tryptophan-waso-endpoint-correction-20260830",
      "authoringPackId": "ap_bp_wp_compound_tryptophan_src_pubmed_33942088",
      "workpackId": "wp_compound_tryptophan",
      "entityType": "compound",
      "entitySlug": "tryptophan",
      "sourceId": "src_pubmed-33942088",
      "topicType": "conflict_note",
      "claimType": "evidence_conflict",
      "evidenceClass": "human-clinical",
      "findingTextShort": "PMID 33942088 supports shorter wake after sleep onset (WASO), not the profile's stated pooled sleep-latency benefit.",
      "findingTextNormalized": "The 2022 systematic review/meta-analysis/meta-regression identified 18 articles, but only four contributed to the random-effects meta-analysis. Its significant pooled sleep endpoint was shorter wake after sleep onset (WASO); the review reported no effect on other sleep components. The current profile statement that L-tryptophan has moderate evidence for modest sleep-latency reduction therefore mismatches the endpoint established by the modern pooled analysis and requires semantic correction before promotion.",
      "strengthLabel": "strong",
      "populationContext": "Human tryptophan-supplementation studies included in a 2022 systematic review/meta-analysis/meta-regression of sleep quality.",
      "usageContext": "Tryptophan supplementation across heterogeneous human sleep studies; four articles contributed to the random-effects pooled analysis.",
      "uncertaintyNote": "WASO and sleep-onset latency are distinct endpoints. A statistically significant pooled WASO result cannot be relabeled as sleep-latency evidence.",
      "reviewStatus": "draft_submission",
      "editorialStatus": "needs_review",
      "active": true
    },
    {
      "submissionId": "sub_session-b-tryptophan-waso-limited-signal-20260830",
      "authoringPackId": "ap_bp_wp_compound_tryptophan_src_pubmed_33942088",
      "workpackId": "wp_compound_tryptophan",
      "entityType": "compound",
      "entitySlug": "tryptophan",
      "sourceId": "src_pubmed-33942088",
      "topicType": "supported_use",
      "claimType": "efficacy_signal",
      "evidenceClass": "human-clinical",
      "findingTextShort": "A 2022 synthesis found a pooled reduction in wake after sleep onset, with a stronger signal in analyses around at least 1 g/day, but no effect on other sleep components.",
      "findingTextNormalized": "The 2022 tryptophan sleep synthesis reported shorter wake after sleep onset in the random-effects analysis and a stronger WASO signal in subgroup/meta-regression analyses around at least 1 g/day. Other sleep components were not significantly improved in the review. This supports at most a bounded WASO/sleep-maintenance signal rather than a universal insomnia-treatment or sleep-onset claim.",
      "strengthLabel": "limited",
      "populationContext": "Human participants across heterogeneous tryptophan-supplementation sleep studies summarized in the 2022 review.",
      "usageContext": "Tryptophan supplementation with dose-stratified analyses; formulation, population, and study-design differences remain material.",
      "uncertaintyNote": "Only four of 18 identified articles entered the pooled meta-analysis. The dose subgroup/meta-regression finding is not a clinical recommended-dose threshold.",
      "reviewStatus": "draft_submission",
      "editorialStatus": "draft",
      "active": true
    },
    {
      "submissionId": "sub_session-b-tryptophan-historical-latency-signal-20260830",
      "authoringPackId": "ap_bp_wp_compound_tryptophan_src_pubmed_227180",
      "workpackId": "wp_compound_tryptophan",
      "entityType": "compound",
      "entitySlug": "tryptophan",
      "sourceId": "src_pubmed-227180",
      "topicType": "supported_use",
      "claimType": "efficacy_signal",
      "evidenceClass": "human-clinical",
      "findingTextShort": "A small 1979 sleep-laboratory trial found 3 g L-tryptophan shortened sleep-onset latency on some nights, while 1 g did not establish the same effect and REM/SWS/wakefulness were unchanged.",
      "findingTextNormalized": "In a double-blind controlled sleep-laboratory study of 18 women with prolonged sleep-onset latency, placebo, 1 g L-tryptophan, and 3 g L-tryptophan were compared across repeated nights. The 3 g condition significantly reduced sleep-onset latency on some nights, while neither dose differed from placebo for REM sleep, slow-wave sleep, or wakefulness. Adaptation to the sleep laboratory occurred across the study, limiting broad generalization.",
      "strengthLabel": "limited",
      "populationContext": "18 women with demonstrated laboratory sleep-onset latency greater than 20 minutes on two nights.",
      "usageContext": "Purified L-tryptophan, 1 g or 3 g, administered before lights-out in a repeated-night sleep-laboratory protocol.",
      "uncertaintyNote": "Small sample, selected-night significance, historical study methods, and laboratory-adaptation effects prevent treating this as universal insomnia efficacy or a general 3 g recommendation.",
      "reviewStatus": "draft_submission",
      "editorialStatus": "draft",
      "active": true
    },
    {
      "submissionId": "sub_session-b-tryptophan-regimen-formulation-gap-20260830",
      "authoringPackId": "ap_bp_wp_compound_tryptophan_src_pubmed_33942088",
      "workpackId": "wp_compound_tryptophan",
      "entityType": "compound",
      "entitySlug": "tryptophan",
      "sourceId": "src_pubmed-33942088",
      "topicType": "research_gap",
      "claimType": "research_gap",
      "evidenceClass": "human-clinical",
      "findingTextShort": "The ≥1 g/day subgroup/meta-regression signal does not make the profile's 'powder or capsule' text a dose or establish one universal sleep regimen.",
      "findingTextNormalized": "The modern synthesis reports dose-stratified sleep findings, but a subgroup/meta-regression threshold is not a recommended regimen. The current profile text 'powder or capsule' is a dosage-form description rather than an amount, frequency, duration, preparation, or population-specific regimen. Dietary tryptophan, purified L-tryptophan supplements, and tryptophan-enriched foods should remain distinct until formulation-specific evidence is explicitly governed.",
      "strengthLabel": "insufficient",
      "usageContext": "Dose/regimen and intervention-identity gap across heterogeneous tryptophan sleep studies.",
      "uncertaintyNote": "Meta-regression and subgroup associations should not be converted into consumer dose recommendations, and product form is not dose evidence.",
      "reviewStatus": "draft_submission",
      "editorialStatus": "draft",
      "active": true
    },
    {
      "submissionId": "sub_session-b-tryptophan-serotonergic-safety-source-gap-20260830",
      "authoringPackId": "ap_bp_wp_compound_tryptophan_src_pubmed_33942088",
      "workpackId": "wp_compound_tryptophan",
      "entityType": "compound",
      "entitySlug": "tryptophan",
      "sourceId": "src_pubmed-33942088",
      "topicType": "research_gap",
      "claimType": "research_gap",
      "evidenceClass": "human-clinical",
      "findingTextShort": "The sleep-efficacy synthesis does not establish the profile's current serotonergic medication warnings; those safety statements require separate authoritative receipts.",
      "findingTextNormalized": "PMID 33942088 addresses tryptophan supplementation and sleep endpoints, not a governed interaction evaluation for SSRIs, MAOIs, or serotonin-syndrome risk. The profile's current medication-safety language therefore remains outside this efficacy source's evidentiary scope and should not be treated as sourced merely because the mechanism involves serotonin biology. Independent safety/interaction evidence is required before any recommendation-state or indexability change.",
      "strengthLabel": "insufficient",
      "safetyContext": "Existing serotonergic medication cautions remain unverified at the canonical source-graph layer in this workpack.",
      "uncertaintyNote": "This is a source-scope gap, not evidence that the interaction risk is absent. The appropriate action is separate safety sourcing, not deletion or promotion from mechanism alone.",
      "reviewStatus": "draft_submission",
      "editorialStatus": "needs_review",
      "active": true
    }
  ]
}
